"codigo_producto","nombre","gama","dimensiones","proveedor","descripcion","cantidad_en_stock","precio_venta","precio_proveedor"
"11679","Sierra de Poda 400MM","Herramientas","0,258","HiperGarden Tools","Gracias a la poda se consigue manipular un poco la naturaleza, dándole la forma que más nos guste. Este trabajo básico de jardinería también facilita que las plantas crezcan de un modo más equilibrado, y que las flores y los frutos vuelvan cada año con regularidad. Lo mejor es dar forma cuando los ejemplares son jóvenes, de modo que exijan pocos cuidados cuando sean adultos. Además de saber cuándo y cómo hay que podar, tener unas herramientas adecuadas para esta labor es también de vital importancia.",15,14.00,11.00
"21636","Pala","Herramientas","0,156","HiperGarden Tools","Palas de acero con cresta de corte en la punta para cortar bien el terreno. Buena penetración en tierras muy compactas.",15,14.00,13.00
"22225","Rastrillo de Jardín","Herramientas","1,064","HiperGarden Tools","Fabuloso rastillo que le ayudará a eliminar piedras, hojas, ramas y otros elementos incómodos en su jardín.",15,12.00,11.00
"30310","Azadón","Herramientas","0,168","HiperGarden Tools","Longitud:24cm. Herramienta fabricada en acero y pintura epoxi,alargando su durabilidad y preveniendo la corrosión.Diseño pensado para el ahorro de trabajo.",15,12.00,11.00
"AR-001","Ajedrea","Aromáticas","15-20","Murcia Seasons","Planta aromática que fresca se utiliza para condimentar carnes y ensaladas, y seca, para pastas, sopas y guisantes",140,1.00,0.00
"AR-002","Lavándula Dentata","Aromáticas","15-20","Murcia Seasons","Espliego de jardín, Alhucema rizada, Alhucema dentada, Cantueso rizado. Familia: Lamiaceae.Origen: España y Portugal. Mata de unos 60 cm de alto. Las hojas son aromáticas, dentadas y de color verde grisáceas.  Produce compactas espigas de flores pequeñas, ligeramente aromáticas, tubulares,de color azulado y con brácteas púrpuras.  Frutos: nuececillas alargadas encerradas en el tubo del cáliz.  Se utiliza en jardineria y no en perfumeria como otros cantuesos, espliegos y lavandas.  Tiene propiedades aromatizantes y calmantes. Adecuadas para la formación de setos bajos. Se dice que su aroma ahuyenta pulgones y otros insectos perjudiciales para las plantas vecinas.",140,1.00,0.00
"AR-003","Mejorana","Aromáticas","15-20","Murcia Seasons","Origanum majorana. No hay que confundirlo con el orégano. Su sabor se parece más al tomillo, pero es más dulce y aromático.Se usan las hojas frescas o secas, picadas, machacadas o en polvo, en sopas, rellenos, quiches y tartas, tortillas, platos con papas y, como aderezo, en ramilletes de hierbas.El sabor delicado de la mejorana se elimina durante la cocción, de manera que es mejor agregarla cuando el plato esté en su punto o en aquéllos que apenas necesitan cocción.",140,1.00,0.00
"AR-004","Melissa ","Aromáticas","15-20","Murcia Seasons","Es una planta perenne (dura varios años) conocida por el agradable y característico olor a limón que desprenden en verano. Nunca debe faltar en la huerta o jardín por su agradable aroma y por los variados usos que tiene: planta olorosa, condimentaria y medicinal. Su cultivo es muy fácil. Le va bien un suelo ligero, con buen drenaje y riego sin exceso. A pleno sol o por lo menos 5 horas de sol por día. Cada año, su abonado mineral correspondiente.En otoño, la melisa pierde el agradable olor a limón que desprende en verano sus flores azules y blancas. En este momento se debe cortar a unos 20 cm. del suelo. Brotará de forma densa en primavera.",140,1.00,0.00
"AR-005","Mentha Sativa","Aromáticas","15-20","Murcia Seasons","¿Quién no conoce la Hierbabuena? Se trata de una plantita muy aromática, agradable y cultivada extensamente por toda España. Es hierba perenne (por tanto vive varios años, no es anual). Puedes cultivarla en maceta o plantarla en la tierra del jardín o en un rincón del huerto. Lo más importante es que cuente con bastante agua. En primavera debes aportar fertilizantes minerales. Vive mejor en semisombra que a pleno sol.Si ves orugas o los agujeros en hojas consecuencia de su ataque, retíralas una a una a mano; no uses insecticidas químicos.",140,1.00,0.00
"AR-006","Petrosilium Hortense (Peregil)","Aromáticas","15-20","Murcia Seasons","Nombre científico o latino: Petroselinum hortense, Petroselinum crispum. Nombre común o vulgar: Perejil, Perejil rizado Familia: Umbelliferae (Umbelíferas). Origen: el origen del perejil se encuentra en el Mediterraneo. Esta naturalizada en casi toda Europa. Se utiliza como condimento y para adorno, pero también en ensaladas. Se suele regalar en las fruterías y verdulerías.El perejil lo hay de 2 tipos: de hojas planas y de hojas rizadas.",140,1.00,0.00
"AR-007","Salvia Mix","Aromáticas","15-20","Murcia Seasons","La Salvia es un pequeño arbusto que llega hasta el metro de alto.Tiene una vida breve, de unos pocos años.En el jardín, como otras aromáticas, queda muy bien en una rocalla o para hacer una bordura perfumada a cada lado de un camino de Salvia. Abona después de cada corte y recorta el arbusto una vez pase la floración.",140,1.00,0.00
"AR-008","Thymus Citriodra (Tomillo limón)","Aromáticas","15-20","Murcia Seasons","Nombre común o vulgar: Tomillo, Tremoncillo Familia: Labiatae (Labiadas).Origen: Región mediterránea.Arbustillo bajo, de 15 a 40 cm de altura. Las hojas son muy pequeñas, de unos 6 mm de longitud; según la variedad pueden ser verdes, verdes grisáceas, amarillas, o jaspeadas. Las flores aparecen de mediados de primavera hasta bien entrada la época estival y se presentan en racimos terminales que habitualmente son de color violeta o púrpura aunque también pueden ser blancas. Esta planta despide un intenso y típico aroma, que se incrementa con el roce. El tomillo resulta de gran belleza cuando está en flor. El tomillo atrae a avispas y abejas. En jardinería se usa como manchas, para hacer borduras, para aromatizar el ambiente, llenar huecos, cubrir rocas, para jardines en miniatura, etc. Arranque las flores y hojas secas del tallo y añadálos a un popurri, introdúzcalos en saquitos de hierbas o en la almohada.También puede usar las ramas secas con flores para añadir aroma y textura a cestos abiertos.",140,1.00,0.00
"AR-009","Thymus Vulgaris","Aromáticas","15-20","Murcia Seasons","Nombre común o vulgar: Tomillo, Tremoncillo Familia: Labiatae (Labiadas). Origen: Región mediterránea. Arbustillo bajo, de 15 a 40 cm de altura. Las hojas son muy pequeñas, de unos 6 mm de longitud; según la variedad pueden ser verdes, verdes grisáceas, amarillas, o jaspeadas. Las flores aparecen de mediados de primavera hasta bien entrada la época estival y se presentan en racimos terminales que habitualmente son de color violeta o púrpura aunque también pueden ser blancas. Esta planta despide un intenso y típico aroma, que se incrementa con el roce. El tomillo resulta de gran belleza cuando está en flor. El tomillo atrae a avispas y abejas.\r\n En jardinería se usa como manchas, para hacer borduras, para aromatizar el ambiente, llenar huecos, cubrir rocas, para jardines en miniatura, etc. Arranque las flores y hojas secas del tallo y añadálos a un popurri, introdúzcalos en saquitos de hierbas o en la almohada. También puede usar las ramas secas con flores para añadir aroma y textura a cestos abiertos.",140,1.00,0.00
"AR-010","Santolina Chamaecyparys","Aromáticas","15-20","Murcia Seasons","",140,1.00,0.00
"FR-1","Expositor Cítricos Mix","Frutales","100-120","Frutales Talavera S.A","",15,7.00,5.00
"FR-31","Ciruelo Santa Rosa","Frutales","","Frutales Talavera S.A","árbol de tamaño mediano que alcanza una altura máxima de 5-6 m. Tronco de corteza pardo-azulada, brillante, lisa o agrietada longitudinalmente. Produce ramas alternas, pequeñas, delgadas, unas veces lisas, glabras y otras pubescentes y vellosas",400,8.00,6.00
"FR-10","Limonero 2 años injerto","Frutales","","NaranjasValencianas.com","El limonero, pertenece al grupo de los cítricos, teniendo su origen hace unos 20 millones de años en el sudeste asiático. Fue introducido por los árabes en el área mediterránea entre los años 1.000 a 1.200, habiendo experimentando numerosas modificaciones debidas tanto a la selección natural mediante hibridaciones espontáneas como a las producidas por el hombre, en este caso buscando las necesidades del mercado.",15,7.00,5.00
"FR-100","Nectarina","Frutales","8/10","Frutales Talavera S.A","Se trata de un árbol derivado por mutación de los melocotoneros comunes, y los únicos caracteres diferenciales son la ausencia de tomentosidad en la piel del fruto. La planta, si se deja crecer libremente, adopta un porte globoso con unas dimensiones medias de 4-6 metros",50,11.00,8.00
"FR-101","Nogal","Frutales","8/10","Frutales Talavera S.A","",50,13.00,10.00
"FR-102","Olea-Olivos","Frutales","8/10","Frutales Talavera S.A","Existen dos hipótesis sobre el origen del olivo, una que postula que proviene de las costas de Siria, Líbano e Israel y otra que considera que lo considera originario de Asia menor. La llegada a Europa probablemente tuvo lugar de mano de los Fenicios, en transito por Chipre, Creta, e Islas del Mar Egeo, pasando a Grecia y más tarde a Italia. Los primeros indicios de la presencia del olivo en las costas mediterráneas españolas coinciden con el dominio romano, aunque fueron posteriormente los árabes los que impulsaron su cultivo en Andalucía, convirtiendo a España en el primer país productor de aceite de oliva a nivel mundial.",50,18.00,14.00
"FR-103","Olea-Olivos","Frutales","10/12","Frutales Talavera S.A","Existen dos hipótesis sobre el origen del olivo, una que postula que proviene de las costas de Siria, Líbano e Israel y otra que considera que lo considera originario de Asia menor. La llegada a Europa probablemente tuvo lugar de mano de los Fenicios, en transito por Chipre, Creta, e Islas del Mar Egeo, pasando a Grecia y más tarde a Italia. Los primeros indicios de la presencia del olivo en las costas mediterráneas españolas coinciden con el dominio romano, aunque fueron posteriormente los árabes los que impulsaron su cultivo en Andalucía, convirtiendo a España en el primer país productor de aceite de oliva a nivel mundial.",50,25.00,20.00
"FR-104","Olea-Olivos","Frutales","12/4","Frutales Talavera S.A","Existen dos hipótesis sobre el origen del olivo, una que postula que proviene de las costas de Siria, Líbano e Israel y otra que considera que lo considera originario de Asia menor. La llegada a Europa probablemente tuvo lugar de mano de los Fenicios, en transito por Chipre, Creta, e Islas del Mar Egeo, pasando a Grecia y más tarde a Italia. Los primeros indicios de la presencia del olivo en las costas mediterráneas españolas coinciden con el dominio romano, aunque fueron posteriormente los árabes los que impulsaron su cultivo en Andalucía, convirtiendo a España en el primer país productor de aceite de oliva a nivel mundial.",50,49.00,39.00
"FR-105","Olea-Olivos","Frutales","14/16","Frutales Talavera S.A","Existen dos hipótesis sobre el origen del olivo, una que postula que proviene de las costas de Siria, Líbano e Israel y otra que considera que lo considera originario de Asia menor. La llegada a Europa probablemente tuvo lugar de mano de los Fenicios, en transito por Chipre, Creta, e Islas del Mar Egeo, pasando a Grecia y más tarde a Italia. Los primeros indicios de la presencia del olivo en las costas mediterráneas españolas coinciden con el dominio romano, aunque fueron posteriormente los árabes los que impulsaron su cultivo en Andalucía, convirtiendo a España en el primer país productor de aceite de oliva a nivel mundial.",50,70.00,56.00
"FR-106","Peral","Frutales","8/10","Frutales Talavera S.A","Árbol piramidal, redondeado en su juventud, luego oval, que llega hasta 20 metros de altura y por término medio vive 65 años.Tronco alto, grueso, de corteza agrietada, gris, de la cual se destacan con frecuencia placas lenticulares.Las ramas se insertan formando ángulo agudo con el tronco (45º), de corteza lisa, primero verde y luego gris-violácea, con numerosas lenticelas.",50,11.00,8.00
"FR-107","Peral","Frutales","10/12","Frutales Talavera S.A","Árbol piramidal, redondeado en su juventud, luego oval, que llega hasta 20 metros de altura y por término medio vive 65 años.Tronco alto, grueso, de corteza agrietada, gris, de la cual se destacan con frecuencia placas lenticulares.Las ramas se insertan formando ángulo agudo con el tronco (45º), de corteza lisa, primero verde y luego gris-violácea, con numerosas lenticelas.",50,22.00,17.00
"FR-108","Peral","Frutales","12/14","Frutales Talavera S.A","Árbol piramidal, redondeado en su juventud, luego oval, que llega hasta 20 metros de altura y por término medio vive 65 años.Tronco alto, grueso, de corteza agrietada, gris, de la cual se destacan con frecuencia placas lenticulares.Las ramas se insertan formando ángulo agudo con el tronco (45º), de corteza lisa, primero verde y luego gris-violácea, con numerosas lenticelas.",50,32.00,25.00
"FR-11","Limonero 30/40","Frutales","","NaranjasValencianas.com","El limonero, pertenece al grupo de los cítricos, teniendo su origen hace unos 20 millones de años en el sudeste asiático. Fue introducido por los árabes en el área mediterránea entre los años 1.000 a 1.200, habiendo experimentando numerosas modificaciones debidas tanto a la selección natural mediante hibridaciones espontáneas como a las producidas por el",15,100.00,80.00
"FR-12","Kunquat ","Frutales","","NaranjasValencianas.com","su nombre científico se origina en honor a un hoticultor escocés que recolectó especímenes en China, (\""Fortunella\""), Robert Fortune (1812-1880), y \""margarita\"", del latín margaritus-a-um = perla, en alusión a sus pequeños y brillantes frutos. Se trata de un arbusto o árbol pequeño de 2-3 m de altura, inerme o con escasas espinas.Hojas lanceoladas de 4-8 (-15) cm de longitud, con el ápice redondeado y la base cuneada.Tienen el margen crenulado en su mitad superior, el haz verde brillante y el envés más pálido.Pecíolo ligeramente marginado.Flores perfumadas solitarias o agrupadas en inflorescencias axilares, blancas.El fruto es lo más característico, es el más pequeño de todos los cítricos y el único cuya cáscara se puede comer.Frutos pequeños, con semillas, de corteza fina, dulce, aromática y comestible, y de pulpa naranja amarillenta y ligeramente ácida.Sus frutos son muy pequeños y tienen un carácter principalmente ornamental.",15,21.00,16.00
"FR-13","Kunquat  EXTRA con FRUTA","Frutales","150-170","NaranjasValencianas.com","su nombre científico se origina en honor a un hoticultor escocés que recolectó especímenes en China, (\""Fortunella\""), Robert Fortune (1812-1880), y \""margarita\"", del latín margaritus-a-um = perla, en alusión a sus pequeños y brillantes frutos. Se trata de un arbusto o árbol pequeño de 2-3 m de altura, inerme o con escasas espinas.Hojas lanceoladas de 4-8 (-15) cm de longitud, con el ápice redondeado y la base cuneada.Tienen el margen crenulado en su mitad superior, el haz verde brillante y el envés más pálido.Pecíolo ligeramente marginado.Flores perfumadas solitarias o agrupadas en inflorescencias axilares, blancas.El fruto es lo más característico, es el más pequeño de todos los cítricos y el único cuya cáscara se puede comer.Frutos pequeños, con semillas, de corteza fina, dulce, aromática y comestible, y de pulpa naranja amarillenta y ligeramente ácida.Sus frutos son muy pequeños y tienen un carácter principalmente ornamental.",15,57.00,45.00
"FR-14","Calamondin Mini","Frutales","","Frutales Talavera S.A","Se trata de un pequeño arbolito de copa densa, con tendencia a la verticalidad, inerme o con cortas espinas. Sus hojas son pequeñas, elípticas de 5-10 cm de longitud, con los pecíolos estrechamente alados.Posee 1 o 2 flores en situación axilar, al final de las ramillas.Sus frutos son muy pequeños (3-3,5 cm de diámetro), con pocas semillas, esféricos u ovales, con la zona apical aplanada; corteza de color naranja-rojizo, muy fina y fácilmente separable de la pulpa, que es dulce, ácida y comestible..",15,10.00,8.00
"FR-15","Calamondin Copa ","Frutales","","Frutales Talavera S.A","Se trata de un pequeño arbolito de copa densa, con tendencia a la verticalidad, inerme o con cortas espinas. Sus hojas son pequeñas, elípticas de 5-10 cm de longitud, con los pecíolos estrechamente alados.Posee 1 o 2 flores en situación axilar, al final de las ramillas.Sus frutos son muy pequeños (3-3,5 cm de diámetro), con pocas semillas, esféricos u ovales, con la zona apical aplanada; corteza de color naranja-rojizo, muy fina y fácilmente separable de la pulpa, que es dulce, ácida y comestible..",15,25.00,20.00
"FR-16","Calamondin Copa EXTRA Con FRUTA","Frutales","100-120","Frutales Talavera S.A","Se trata de un pequeño arbolito de copa densa, con tendencia a la verticalidad, inerme o con cortas espinas. Sus hojas son pequeñas, elípticas de 5-10 cm de longitud, con los pecíolos estrechamente alados.Posee 1 o 2 flores en situación axilar, al final de las ramillas.Sus frutos son muy pequeños (3-3,5 cm de diámetro), con pocas semillas, esféricos u ovales, con la zona apical aplanada; corteza de color naranja-rojizo, muy fina y fácilmente separable de la pulpa, que es dulce, ácida y comestible..",15,45.00,36.00
"FR-17","Rosal bajo 1Âª -En maceta-inicio brotación","Frutales","","Frutales Talavera S.A","",15,2.00,1.00
"FR-18","ROSAL TREPADOR","Frutales","","Frutales Talavera S.A","",350,4.00,3.00
"FR-19","Camelia Blanco, Chrysler Rojo, Soraya Naranja, ","Frutales","","NaranjasValencianas.com","",350,4.00,3.00
"FR-2","Naranjo -Plantón joven 1 año injerto","Frutales","","NaranjasValencianas.com","El naranjo es un árbol pequeño, que no supera los 3-5 metros de altura, con una copa compacta, cónica, transformada en esérica gracias a la poda. Su tronco es de color gris y liso, y las hojas son perennes, coriáceas, de un verde intenso y brillante, con forma oval o elíptico-lanceolada. Poseen, en el caso del naranjo amargo, un típico peciolo alado en forma de Â‘corazónÂ’, que en el naranjo dulce es más estrecho y menos patente.",15,6.00,4.00
"FR-20","Landora Amarillo, Rose Gaujard bicolor blanco-rojo","Frutales","","Frutales Talavera S.A","",350,4.00,3.00
"FR-21","Kordes Perfect bicolor rojo-amarillo, Roundelay rojo fuerte","Frutales","","Frutales Talavera S.A","",350,4.00,3.00
"FR-22","Pitimini rojo","Frutales","","Frutales Talavera S.A","",350,4.00,3.00
"FR-23","Rosal copa ","Frutales","","Frutales Talavera S.A","",400,8.00,6.00
"FR-24","Albaricoquero Corbato","Frutales","","Melocotones de Cieza S.A.","árbol que puede pasar de los 6 m de altura, en la región mediterránea con ramas formando una copa redondeada. La corteza del tronco es pardo-violácea, agrietada; las ramas son rojizas y extendidas cuando jóvenes y las ramas secundarias son cortas, divergentes y escasas. Las yemas latentes son frecuentes especialmente sobre las ramas viejas.",400,8.00,6.00
"FR-25","Albaricoquero Moniqui","Frutales","","Melocotones de Cieza S.A.","árbol que puede pasar de los 6 m de altura, en la región mediterránea con ramas formando una copa redondeada. La corteza del tronco es pardo-violácea, agrietada; las ramas son rojizas y extendidas cuando jóvenes y las ramas secundarias son cortas, divergentes y escasas. Las yemas latentes son frecuentes especialmente sobre las ramas viejas.",400,8.00,6.00
"FR-26","Albaricoquero Kurrot","Frutales","","Melocotones de Cieza S.A.","árbol que puede pasar de los 6 m de altura, en la región mediterránea con ramas formando una copa redondeada. La corteza del tronco es pardo-violácea, agrietada; las ramas son rojizas y extendidas cuando jóvenes y las ramas secundarias son cortas, divergentes y escasas. Las yemas latentes son frecuentes especialmente sobre las ramas viejas.",400,8.00,6.00
"FR-27","Cerezo Burlat","Frutales","","Jerte Distribuciones S.L.","Las principales especies de cerezo cultivadas en el mundo son el cerezo dulce (Prunus avium), el guindo (P. cerasus) y el cerezo \""Duke\"", híbrido de los anteriores. Ambas especies son naturales del sureste de Europa y oeste de Asia. El cerezo dulce tuvo su origen probablemente en el mar Negro y en el mar Caspio, difundiéndose después hacia Europa y Asia, llevado por los pájaros y las migraciones humanas. Fue uno de los frutales más apreciados por los griegos y con el Imperio Romano se extendió a regiones muy diversas. En la actualidad, el cerezo se encuentra difundido por numerosas regiones y países del mundo con clima templado",400,8.00,6.00
"FR-28","Cerezo Picota","Frutales","","Jerte Distribuciones S.L.","Las principales especies de cerezo cultivadas en el mundo son el cerezo dulce (Prunus avium), el guindo (P. cerasus) y el cerezo \""Duke\"", híbrido de los anteriores. Ambas especies son naturales del sureste de Europa y oeste de Asia. El cerezo dulce tuvo su origen probablemente en el mar Negro y en el mar Caspio, difundiéndose después hacia Europa y Asia, llevado por los pájaros y las migraciones humanas. Fue uno de los frutales más apreciados por los griegos y con el Imperio Romano se extendió a regiones muy diversas. En la actualidad, el cerezo se encuentra difundido por numerosas regiones y países del mundo con clima templado",400,8.00,6.00
"FR-29","Cerezo Napoleón","Frutales","","Jerte Distribuciones S.L.","Las principales especies de cerezo cultivadas en el mundo son el cerezo dulce (Prunus avium), el guindo (P. cerasus) y el cerezo \""Duke\"", híbrido de los anteriores. Ambas especies son naturales del sureste de Europa y oeste de Asia. El cerezo dulce tuvo su origen probablemente en el mar Negro y en el mar Caspio, difundiéndose después hacia Europa y Asia, llevado por los pájaros y las migraciones humanas. Fue uno de los frutales más apreciados por los griegos y con el Imperio Romano se extendió a regiones muy diversas. En la actualidad, el cerezo se encuentra difundido por numerosas regiones y países del mundo con clima templado",400,8.00,6.00
"FR-3","Naranjo 2 años injerto","Frutales","","NaranjasValencianas.com","El naranjo es un árbol pequeño, que no supera los 3-5 metros de altura, con una copa compacta, cónica, transformada en esérica gracias a la poda. Su tronco es de color gris y liso, y las hojas son perennes, coriáceas, de un verde intenso y brillante, con forma oval o elíptico-lanceolada. Poseen, en el caso del naranjo amargo, un típico peciolo alado en forma de Â‘corazónÂ’, que en el naranjo dulce es más estrecho y menos patente.",15,7.00,5.00
"FR-30","Ciruelo R. Claudia Verde   ","Frutales","","Frutales Talavera S.A","árbol de tamaño mediano que alcanza una altura máxima de 5-6 m. Tronco de corteza pardo-azulada, brillante, lisa o agrietada longitudinalmente. Produce ramas alternas, pequeñas, delgadas, unas veces lisas, glabras y otras pubescentes y vellosas",400,8.00,6.00
"OR-120","Lonicera Nitida ","Ornamentales","35-45","Viveros EL OASIS","",120,5.00,4.00
"OR-121","Lonicera Nitida \""Maigrum\""","Ornamentales","35-45","Viveros EL OASIS","",120,5.00,4.00
"OR-122","Lonicera Pileata","Ornamentales","35-45","Viveros EL OASIS","",120,5.00,4.00
"FR-32","Ciruelo Golden Japan","Frutales","","Frutales Talavera S.A","árbol de tamaño mediano que alcanza una altura máxima de 5-6 m. Tronco de corteza pardo-azulada, brillante, lisa o agrietada longitudinalmente. Produce ramas alternas, pequeñas, delgadas, unas veces lisas, glabras y otras pubescentes y vellosas",400,8.00,6.00
"FR-33","Ciruelo Friar","Frutales","","Frutales Talavera S.A","árbol de tamaño mediano que alcanza una altura máxima de 5-6 m. Tronco de corteza pardo-azulada, brillante, lisa o agrietada longitudinalmente. Produce ramas alternas, pequeñas, delgadas, unas veces lisas, glabras y otras pubescentes y vellosas",400,8.00,6.00
"FR-34","Ciruelo Reina C. De Ollins","Frutales","","Frutales Talavera S.A","árbol de tamaño mediano que alcanza una altura máxima de 5-6 m. Tronco de corteza pardo-azulada, brillante, lisa o agrietada longitudinalmente. Produce ramas alternas, pequeñas, delgadas, unas veces lisas, glabras y otras pubescentes y vellosas",400,8.00,6.00
"FR-35","Ciruelo Claudia Negra","Frutales","","Frutales Talavera S.A","árbol de tamaño mediano que alcanza una altura máxima de 5-6 m. Tronco de corteza pardo-azulada, brillante, lisa o agrietada longitudinalmente. Produce ramas alternas, pequeñas, delgadas, unas veces lisas, glabras y otras pubescentes y vellosas",400,8.00,6.00
"FR-36","Granado Mollar de Elche","Frutales","","Frutales Talavera S.A","pequeño árbol caducifolio, a veces con porte arbustivo, de 3 a 6 m de altura, con el tronco retorcido. Madera dura y corteza escamosa de color grisáceo. Las ramitas jóvenes son más o menos cuadrangulares o angostas y de cuatro alas, posteriormente se vuelven redondas con corteza de color café grisáceo, la mayoría de las ramas, pero especialmente las pequeñas ramitas axilares, son en forma de espina o terminan en una espina aguda; la copa es extendida.",400,9.00,7.00
